date,time,user_name,text,link,retweet_counts,favorite_counts,hashtags,GeoInformation
2020-08-20,06:00:50,dddansori2,"윤석열, 어디 숨어서 뭐하냐? 사랑제일교회 압수수색 안하냐? 조국은 다음날부터 100여군데 압수수색했잖아? 경기도 이천 물류센타화재 때는 득달같이 나타나 수사를 명령하더니...",https://twitter.com/dddansori2/status/1296326306808782848,0,0,,
2020-08-20,05:57:21,118296ca7a024eb,한국방송공사 사장님께 삼성화재 사기보험 교통사고 약도조작 조작업무 업무조작 제보 받고 보도 안 하십니다 존경하는 사장님께서 왜 그러시는지 말씀 하시어 주시기 간절히 바랍니다 ,https://twitter.com/118296ca7a024eb/status/1296325429024813056,0,0,,
2020-08-20,05:46:08,iina_you,물이천장에서걍쏟아져서 복도랑 아니 아이씨유앞에 정전되고 쟈꾸화재경보울림 ㅋ ㅋ ㅠ ㅠ ㅠ ㅠ ㅠ ㅠ ㅠ,https://twitter.com/iina_you/status/1296322606744784898,0,2,,
2020-08-20,05:40:36,BW_Oduk,알박기 해놓고 보상금 타내려고 저 난리 치고 있는 놈들이라 불나면 얼씨구나 하고 화재 배상금 내놔라 이러지 않을까요 ,https://twitter.com/BW_Oduk/status/1296321215569653760,0,0,,
2020-08-20,05:40:27,Rockor_Cos,어디 화재 났슴까?,https://twitter.com/Rockor_Cos/status/1296321174805180416,0,0,,
2020-08-20,05:37:15,Mashmellre_KOP,헉 화성에 불났대요ㅠㅠㅠ? 고3때 화성에서 살았던지라 학교 근처에서 불난거 보고 그 뒤로 아무소식 못들었는데 화재소식으로 또 듣네요.. 다들 괜찮으신지 걱정이에요 ,https://twitter.com/Mashmellre_KOP/status/1296320371457536000,0,0,,
2020-08-20,05:34:45,harusari_0,아니 화성시에서 정조랑 사도세자 위패 화재로 소실됐다 그래서.,https://twitter.com/harusari_0/status/1296319742815305729,0,0,,
2020-08-20,05:30:24,somsom_yuri,화재 원인이 누전으로 추정되고 있다고 합니다... ㅠㅠㅠㅠㅠㅠㅠㅠㅠㅠㅠㅠㅠㅠㅠㅠㅠㅠㅠㅠㅠㅠㅠㅠㅠㅠㅠㅠㅠㅠ,https://twitter.com/somsom_yuri/status/1296318645660839936,0,0,,
2020-08-20,05:26:09,LOHrabbit,학교에 전기포트 가져오시면 클납니다 화재위험이있어서 보온병에해주세요 ~지나가는실습생~,https://twitter.com/LOHrabbit/status/1296317575287025665,0,2,,
2020-08-20,05:22:50,sayri_07,헐? 위패 소실이라니... 화재 원인 빨리 알아냇으면,https://twitter.com/sayri_07/status/1296316742461870081,0,0,,
2020-08-20,05:14:07,fly2the_mo0n,"기안84의 웹툰을 본적이 단 한번도 없다. 그간 숱한 비하와 차별, 혐오로 보고싶단 생각을 한적도 없다. 이번 논란으로 처음으로 그의 웹툰(화재의 장면이 나온 화와 그 이전 화)을 뭐길래 그러나 하고 한번 보았는데 기분이 참 불쾌하고 역시 볼 것이 못 된다고 생각하고 껐다. 화도 났으나 독자가 각",https://twitter.com/fly2the_mo0n/status/1296314548060708865,0,1,,
2020-08-20,05:11:43,Stella_Cantata,외부 방화보다는 내부에서 화재가 일어난 것 같다고 추정중이래요...,https://twitter.com/Stella_Cantata/status/1296313944965967873,0,1,,
2020-08-20,05:07:23,kagebrulee,미쳤습ㄴ;까 학교가 저희를 구워먹으려고 하고 있어요 화재경보올려서 땡볕에 나갔다옴,https://twitter.com/kagebrulee/status/1296312854065188864,0,0,,
2020-08-20,05:05:37,myungrang,방화인지 실화인지 전기누전에의한 화재인지 빨리밝혀야겄네. ,https://twitter.com/myungrang/status/1296312409754185728,0,0,,
2020-08-20,05:02:15,nocturnal12_12,"700여 차례의 화재 구급 현장에 출동, 2019년 8월 충주 중원산업단지 폭발사고 때는 근로자 대피 부상자 응급처치에 앞장섰다. 코로나19 확산으로 충주에서 해외입국자 임시생활시설이 운용됐을 때는 가장 먼저 시설 배치를 자원하기도 했다 https://news.v.daum.net/v/20200820135040600 삼가 고인의 명복을 빕니다",https://twitter.com/nocturnal12_12/status/1296311564044087296,5,0,,
2020-08-20,04:57:26,minwoo_hm_bot,화재 이후 계솔이가 보이지 않는다. 어디로 간거지?,https://twitter.com/minwoo_hm_bot/status/1296310348622917634,0,0,,
2020-08-20,04:53:57,dog_frog_,갑자기 화재....?,https://twitter.com/dog_frog_/status/1296309473879814144,0,0,,
2020-08-20,04:51:45,HNN_COMM,귀여워... 해밍리고네 집 화재안전은 휴고가 도맡고있어ㅠㅠ 아스터 플라밍고퀸해?? 알로하 멋진 완댜님 옷 ㅇ입고 런웨이에서 폼잡을거 같다구요 실컷 사진 찍고 귀여워해줘야지,https://twitter.com/HNN_COMM/status/1296308920357515264,0,0,,
2020-09-02,10:43:53,lalalatping,"미백으로 유명한 김민정 크림 이벤트 진행중이네요,, 12차 완판 기념 이벤트래요!!,, 주름 잡티 기미 미백에 효과가 있다니까 피부 고민 있으신분들은 신청해보세요!!",https://twitter.com/lalalatping/status/1301108577822584834,24,83,,
2020-08-20,04:43:15,tiaokan,암턴 용주사 화재 얘기 들으니 갑자기...그렇네요,https://twitter.com/tiaokan/status/1296306781488967682,0,0,,
2020-08-20,04:36:24,insight_co_kr,정조대왕·사도세자·혜경궁 홍씨 위패 모신 용주사 호성전 모두 불탔다 #용주사 #호성전 #화재 #문화재,https://twitter.com/insight_co_kr/status/1296305056635994112,5,4,,
2020-08-20,04:32:36,yasashii__no1,"하하, 그래요. 폭탄 때도 안 터진 스프링클러랑 화재경보 얘기도 빼놓지 말아요.",https://twitter.com/yasashii__no1/status/1296304101085478912,0,0,,
2020-08-20,04:31:12,tbsseoul,[차량화재 13:28 현재] 서해안고속도로 (목포 → 서울) 부안나들목부근 갓길 화물차화재로 사고위험 있으니 도로이용에 참고하시기 바랍니다. ,https://twitter.com/tbsseoul/status/1296303748013154304,0,0,,
2020-08-20,04:30:40,bluebluesky1115,"경기도 행정 책임자인 도지시가 할말이냐? 그렇게될때까지 이재명은 경기도에서 뭐했는데? 수해 나도 모른척, 돼지열병도 모른척, 화재도 정부탓, 코로나도 먼산 불구경. 이런게 혼자 대선 운동중이지! 연합뉴스는 이재명발 보도 말고 취재를해라!!!!!!!!!",https://twitter.com/bluebluesky1115/status/1296303614156103680,0,1,,
2020-08-20,04:27:13,Vjs8Vt2kimXXJLu,화재 핫플 98년생 단톡방 화재 궁금하면 들어와봐 나가는건 자유니까 검지로 오른쪽을 가리키는 손등검지로 왼쪽을 가리키는 손등 개념챙긴 동갑들이랑 수다나 떨자 http://open.kakao.com/o/gL2E6e9b,https://twitter.com/Vjs8Vt2kimXXJLu/status/1296302744341327872,0,0,,
2020-08-20,04:23:15,Adel_gentle,전함딜은 관통몇번보다 화재한번이 더 크지 않을까 싶은데,https://twitter.com/Adel_gentle/status/1296301747342675968,0,0,,
2020-08-20,04:22:32,skylove0310,"화성시 용주사의 호성전이 화재로 전소. 호성전 안에 있던 조선 22대 임금인 정조대왕, 사도세자, 혜경궁 홍씨, 효의왕후 김씨(정조의 비)의 위패가 모두 불에 소실. 용주사는 조선 22대 임금 정조가 장조(사도세자)가 묻힌 융릉을 수호하고 망자의 명복을 빌기 위해 지은 절. ",https://twitter.com/skylove0310/status/1296301567209926657,4,1,,
2020-08-20,04:22:13,langyatee,용주사 화재 어떻하냐 진짜. 대웅전 안 탄건 천만다행인데 영가전에 불이 나다니ㅠㅠㅠㅠ,https://twitter.com/langyatee/status/1296301488021442560,0,0,,
2020-08-20,04:21:31,BreakNewsCom,계양구 아파트 에어컨 화재 소화기로 자체진화 / 브레이크뉴스 ,https://twitter.com/BreakNewsCom/status/1296301310669500416,0,0,,
2020-08-20,04:20:06,BreakNewsCom,"의정부, ‘아파트 화재’ 피해 막은 시민에게 표창 수여 / 브레이크뉴스 https://www.breaknews.com/749913",https://twitter.com/BreakNewsCom/status/1296300954703208448,0,0,,
2020-08-20,04:19:42,ramamama_rama,'시간의 계단'은 다산북스가 주최한 웹소설 공모전에서 대상을 수상한 작품이다. 화재사고로 첫사랑을 잃은 32살 여주인공이 모교의 계단을 통해 시간여행을 하게 되면서 과거 화재사고를 해결하면서 죽은 남자친구를 구하려는 과정을 다룬다.,https://twitter.com/ramamama_rama/status/1296300856678088705,0,1,,
2020-08-20,04:19:17,padfoot_591103,ㅋㅋㅋㅋㅋㅋㅋㅋㅋㅋㅋㅋㅋㅋㅋㄱ아딘짜 너무웃겨요 케이크에 화재났다ㅋㅋㅋㅋㅋㅋㅋㅋ 관절건강챙기세요ㅋㅋㅋㅋㅋㅋㅋㅋㅋㅋ,https://twitter.com/padfoot_591103/status/1296300749945634818,0,1,,
2020-08-20,04:13:00,goodomens_s,"어둡고 폭풍우 치는 밤이 아니었다. 어둡고 폭풍우 치는 밤은 이틀 후, 다울링과 영 부인이 가자 아기를 데리고 병원을 나선 지 네 시간이 지나서야 들이닥쳤다.(중략) 화재로 다친 사람은 없었지만, 불길은 몇 시간 동안 잡히지 않았고 상당한 피해를 입혔다. -p.67",https://twitter.com/goodomens_s/status/1296299167837388800,0,0,,
2020-08-20,04:07:11,mypartner0830,누군가가 이사 올때마다 화재가 일어나서 저주받은 집이라고 불리는 저택에 숨어 살던 한유진이랑 한유현... 그리고 저주는 헛소문일 뿐이라며 저택에 새로 이사 온 성현제가 보고싶다,https://twitter.com/mypartner0830/status/1296297703052197888,0,1,,
2020-08-20,04:04:45,leesoo1001,"경기소방, “올 여름 배·분전반 화재 크게 늘어”…주의 당부 ",https://twitter.com/leesoo1001/status/1296297090344075264,0,0,,
2020-08-20,04:01:30,JungenWerther00,용주사 호성전 화재 전기누전이라고 하네;;;,https://twitter.com/JungenWerther00/status/1296296274212188161,0,0,,
2020-08-20,04:00:56,sky613_03,헐? 헐.. 무슨일이야.. 왜.. 근데 정조꺼는 종묘에 안있었나.. ㅠㅠㅠ 화재라니 ㅠㅠㅠ.. 근데 이건 뭐야? 진짜 위패는 아닌가..? https://twitter.com/HuffPostKorea/status/1296277047925518337,https://twitter.com/sky613_03/status/1296296133434593280,0,0,,
2020-08-20,03:57:55,Vjs8Vt2kimXXJLu,디스코드로 대화도 하고 게임두 하는호랑이 얼굴 98년생 단톡방!호랑이 얼굴 관심있다면 혹시 너도 오지않을랭 ?! 화재 핫플에서놀자! 화재http://open.kakao.com/o/gL2E6e9b,https://twitter.com/Vjs8Vt2kimXXJLu/status/1296295371904176128,0,0,,
2020-08-20,03:49:40,TVChosunNews,오늘(20일) 오전 2시33분쯤 울산시 울주군의 한 석유화학공장에서 화재가 발생했다. 신고를 받고 출동한 소방당국은 오전 3시24분쯤 대응 1단계를 발령한 뒤 오전 4시39분쯤 완전히 진화했다. ,https://twitter.com/TVChosunNews/status/1296293295925022720,1,1,,
2020-08-04,08:22:54,uuukorea4,"요즘 살 빼려고 식단 관리 중인데 이 단백질쉐이크 진짜 좋아요. 맛이 질리지 않고 포만감이 좋아서 저녁마다 먹는데, 한끼 칼로리도 95kcal 밖에 안된다고 합니다. 몸 관리하시는 분들한테 식사 대용으로 딱입니다. 운동은 귀찮고 배고픈건 싫은 분들한테 완전 추천!!!",https://twitter.com/uuukorea4/status/1290563852715745282,1520,3873,,
2020-08-20,03:45:50,YJstyleGD,아침에 뉴스에서 용주사 화재 소식 들었는데... 우리 할머니 생전에 제일 많이가셨던 절인데ㅜㅠ 그리구 아직두... 용주사에서 가끔씩 우편오는데ㅠㅠ 할머니 이름으로 ㅜ,https://twitter.com/YJstyleGD/status/1296292330639470593,0,0,,
2020-08-20,03:45:10,ljumrusy407,"여수소방서, 소라센터 마을이장단 농어촌 화재예방교육...",https://twitter.com/ljumrusy407/status/1296292165836926977,0,0,,
2020-08-20,03:42:48,FFKururu37,4. 미각과 후각이 남들보다 배로 높음 미각은 세세하게 다 구별할 줄 알아서 주변인들이 신기해할 지경 후각은 남들이 못 맡는 냄새 혼자 맡아서 화재날뻔한거 미리 막았던 적도 있었음! (비 오기전에도 그 특유의 냄새로 미리 아는편),https://twitter.com/FFKururu37/status/1296291567418843137,0,0,,
2020-08-20,03:39:02,mklonoa_another,어라... 사진을 보면서 나중에 알게된건데... 이상하게 화재가 나면 날수록 집에 가까워지네요. 왠지 기분나쁘달까...,https://twitter.com/mklonoa_another/status/1296290619145334784,0,0,,
2020-08-20,03:38:04,mklonoa_another,올해내내 괴현상이 일어나네요... 1월부터 지금까지 저쪽 방향으로만 벌써 화재가 약 6번째에요. 최소 5번은 넘게 저쪽에서 화제가나요. 더욱 놀라운건 매번 같은 방향에서 화재가 나는데 화재가 난 장소는 매번 달라요... 신가하달까... ,https://twitter.com/mklonoa_another/status/1296290376295133184,0,1,,
2020-08-20,03:34:56,118296ca7a024eb,대통령님께서 도와주세요 삼성화재 사기보험 교통사고 약도조작 조작업무 업무조작 사건2019고정1491 적반하장 경찰불러 피해자를 가해자로 법대로가 맘대로다 개가개를 개로본개 개죽인개 개가튼개 로트바일러 개판닥컴 오리나발 나발통통 통키타곡 개곡울려 나라개판 나라꼬리 요꼴입니 이그노벨상,https://twitter.com/118296ca7a024eb/status/1296289586813919232,0,0,,
2020-08-20,03:31:36,by_Tarisia,뭐야 화재 ?,https://twitter.com/by_Tarisia/status/1296288749588844547,0,0,,
2020-08-20,03:31:29,agit00,"추미애 장관 방문했던 용주사 '호성전' 화재로 전소 - ""20일 새벽 1시 10분쯤 경기 화성의 용주사 호성전(護聖殿)에서 불이 났다"" - ""이곳은 앞서 추미애 법무장관이 지난달 7일 휴가 중 방문해 ‘인증삿’을 올린 곳이기도 하다"" (2020.08.20 조선일보) ",https://twitter.com/agit00/status/1296288722367836160,1,0,,
2020-08-20,03:29:30,happyending401,화재경보가 울려서 신고한건 잘한거지! 아무도 없는 집에서 화재나는 경우가 많으니까! 잘했어 언니ㅠㅠ 놀랬겠다ㅠㅠ,https://twitter.com/happyending401/status/1296288220263510016,0,0,,
2020-08-20,03:29:17,akilover_S2,화재님 졸림수치 37192719%인거같아요,https://twitter.com/akilover_S2/status/1296288164919689217,0,0,,
2020-08-20,03:27:37,kasiya_ladic,"ignis(이그니스 or 이니스)[남성명사] 불, 불길; 횃불; 화재, 번개 라는뜻을 가지고 잇습니다",https://twitter.com/kasiya_ladic/status/1296287748383371266,0,0,,
2020-08-20,03:26:45,oojiya,"재택근무중인데 아파트 화재경보 울려서 내려가보니 평일 낮이라 아무도 신고 안한듯... 119에 우선 신고하고, 소방대와서 확인하길래 방에 돌아왔는데 후덜덜 경찰도 왔네;;;;;; 신고자라고 찾아왔어 죄지은게 없지만 우선 사과해야할 거 같애",https://twitter.com/oojiya/status/1296287529189011456,0,2,,
2020-08-20,03:23:00,akilover_S2,오구구 울 화재님~~!~!~!! 파스타도 할줄아시구 점심도 안거르시구 완존 기특해~~~~~!~!~!!!(화재님: ㅅㅂ머예요,https://twitter.com/akilover_S2/status/1296286587521609728,0,0,,
2020-08-20,03:19:12,miru_roo,ㅓㅜㅑ..화재라니 ㅠ,https://twitter.com/miru_roo/status/1296285628074663936,0,0,,
2020-08-20,03:18:03,IZ3ev0eleipnXov,"[문화예술의전당] 8월 20일 오늘의 날씨, 폭염,비,안개,열대야,낮 기온 39도까지 올라,온열질환주의, 산사태,대형화재 주의 ",https://twitter.com/IZ3ev0eleipnXov/status/1296285339355500545,0,0,,
2020-08-20,03:17:59,ilconashi,화재나면 물뿌려주는 그거 아닐까요?,https://twitter.com/ilconashi/status/1296285324897857536,0,1,,
2020-08-20,03:11:17,kajoo8_kajoo,이것때매 아침에 화재 어쩌구 재난문자온거구나,https://twitter.com/kajoo8_kajoo/status/1296283636388356101,0,0,,
2020-08-20,03:07:10,Hanggong_bot,"2018년 6월 2일 오후 8시 15분경 김포발 도쿄 하네다행 대한항공 2711(KE2711)편이 조종석에 표시된 화물 화재 알림발생 경보로 인해 도쿄 하네다 공항에 긴급착륙하였습니다. 실제로 화제가 발생한 것은 아니고, 조종석의 계기 표시 이상이었다고 합니다. 부상자는 발생하지 않았습니다.",https://twitter.com/Hanggong_bot/status/1296282599078293505,0,0,,
2020-08-20,03:03:49,GoldLullu,"[문화예술의전당] 8월 20일 오늘의 날씨, 폭염,비,안개,열대야,낮 기온 39도까지 올라,온열질환주의, 산사태,대형화재 주의 http://m.lullu.net/26925",https://twitter.com/GoldLullu/status/1296281759374401536,0,0,,
2020-08-20,02:57:02,vTpNQvlAAPLCZOd,"[문화예술의전당] 8월 20일 오늘의 날씨, 폭염,비,안개,열대야,낮 기온 39도까지 올라,온열질환주의, 산사태,대형화재 주의 ",https://twitter.com/vTpNQvlAAPLCZOd/status/1296280050598203392,0,0,,
2020-09-02,10:43:53,lalalatping,"미백으로 유명한 김민정 크림 이벤트 진행중이네요,, 12차 완판 기념 이벤트래요!!,, 주름 잡티 기미 미백에 효과가 있다니까 피부 고민 있으신분들은 신청해보세요!!",https://twitter.com/lalalatping/status/1301108577822584834,24,83,,
2020-08-20,02:54:23,Ken10981193,의사 파업은 비유하자면 전국적으로 화재가 들불처럼 번지는데 소방관 증원하면 승진경쟁 심해진다고 소방관들이 파업하면서 화마에 사람이 죽는건 정부 탓이라고 주장하는 상황. 병원에 불났는데 소방관들이 그런 이유로 파업하면 니들이 납득하겠냐? 이 좋은 대가리 낭비하는 것들아.,https://twitter.com/Ken10981193/status/1296279382470701057,235,165,,
2020-08-20,02:53:15,kq3pRDUnRrPJLh0,"[문화예술의전당] 8월 20일 오늘의 날씨, 폭염,비,안개,열대야,낮 기온 39도까지 올라,온열질환주의, 산사태,대형화재 주의 http://m.lullu.net/26925",https://twitter.com/kq3pRDUnRrPJLh0/status/1296279100290547713,0,0,,
2020-08-20,02:52:18,ZMjqeqCgjYVBsui,무섭네요! 나라 망해야 니들 모가지 유지된다고??? 어떤 짓이라도 할ㄴㄴ들 겁난다. 의혹 많은 물류창고 유류저장소 화재 대형사고??? 관계자분들은 사고 예방에 집중해 주시길... 여적죄는 사형밖에 없다는 건 알지 ,https://twitter.com/ZMjqeqCgjYVBsui/status/1296278857813655555,0,1,,
2020-08-20,02:47:11,lemon_candle001,"용주사 호성전 화재 원인을 찾아라 | 다음뉴스 https://news.v.daum.net/v/20200820104750506 -불에 탄 호성전에는 사도세자, 정조대왕, 경의황후(혜경궁 홍씨), 효의왕후 김씨(정조의 비)의 위패가 모셔져 있었다.",https://twitter.com/lemon_candle001/status/1296277573341609985,0,0,,
2020-08-20,02:46:52,bdecem52,"추미애 장관 방문했던 용주사 '호성전' 화재로 전소 http://news.chosun.com/site/data/html_dir/2020/08/20/2020082000544.html 그래서 사람을 잘 들이라고 했다 추미애가 다시 지어주면 되겠다 요즘 절간이 옛날같은 절간이냐. 절간이 종북이의 소굴이 되었다 절은 옛 절인데 중은 옛 중이 아닌, 똘중만 있다",https://twitter.com/bdecem52/status/1296277491988828160,40,55,,
2020-08-20,02:45:06,HuffPostKorea,화성시 용주사의 호성전이 화재로 전소되어 정조와 사도세자의 위패가 소실됐다 http://huffp.st/TXaDgpO,https://twitter.com/HuffPostKorea/status/1296277047925518337,8185,951,,
2020-08-20,02:42:25,StdStdts,"그나저나 베이애리어가 지금은 그래도 사람들을 끌어모으는 곳이지만 앞으로도 그럴까? 이상기후, 물 부족, 화재 이건 앞으로는 나아지긴커녕 더 악화될 부분일것 같고, 집값도 비싸고, 사람도 많고... 코비드 이후에 재택이 더 일반화되면 점점 더 많이 빠져나가려나.",https://twitter.com/StdStdts/status/1296276371203743745,0,5,,
2020-08-20,02:41:32,Kotomine_3rei,"""지금 부터 5년전 후유키의 지하에 잠들고있던 방대한 천년가스가 무슨일의 탄력인지 불이 붙었지 수 킬로 미터의 지반을 날려 보내고 대 화재가 되버렸다.""",https://twitter.com/Kotomine_3rei/status/1296276152131047425,0,0,,
2020-08-20,02:31:31,skypup627,날 뜨거워지니 bmw 자동차 화재가 또 시작이구만.,https://twitter.com/skypup627/status/1296273631371079680,0,0,,
2020-08-20,02:24:54,kd2728y,"""고양이 실화 추정"" 세종 오피스텔 화재..주민 60명 대피 | 다음 뉴스 ",https://twitter.com/kd2728y/status/1296271964147834880,0,0,,
2020-08-20,02:23:02,sjhong24,제대로 관리되는 아파트에 살고 계신거에요. 아직도 50프로 이상되는 아파트에서 화재수신반 경보 정지 잡아놓고 사용중입니다.,https://twitter.com/sjhong24/status/1296271495627341830,0,0,,
2020-08-20,02:11:29,qpqpabc,[월드스타] 경기도 소방재난본부 “2020년 여름 배·분전반 화재 크게 늘어…각별한 주의 필요˝ http://m.wsnews.co.kr/57929,https://twitter.com/qpqpabc/status/1296268589742219265,0,0,,
2020-08-20,02:08:57,jbdmib,폭염 속 달아오른 차량 내부 최고 90℃까지…화재 위험 전북지역 연일 불볕더위 외부주차 10분만에 50℃ 가연성 물질 폭발 위험 높아 노약자 차량 갇힘 사고 주의,https://twitter.com/jbdmib/status/1296267950148562944,0,0,,
2020-08-20,02:08:47,hyechulson,"옥천소방서, 단독경보형 감지기로 화재 큰 피해 막아 http://www.bzeronews.com/news/articleView.html?idxno=452702",https://twitter.com/hyechulson/status/1296267908041957376,0,0,,
2020-08-20,02:01:39,ankokukanno,그때까지는 아무리 애를 써도 열리지 않던 과거의 기억으로 통하는 문이 그때 그 화재 광경을 보고 있을 때 슬그머니 움직인 것 같은 느낌이 들었다.,https://twitter.com/ankokukanno/status/1296266111277621254,0,0,,
2020-08-20,01:51:36,khrux75,용주사 화재 호성전 전소 안타까운 이유 ,https://twitter.com/khrux75/status/1296263585606201345,0,0,,
2020-08-20,01:42:33,kspnews,"[케이에스피뉴스] 경기도, “올 여름 배·분전반 화재 크게 늘어”…경기도소방 주의 당부 ",https://twitter.com/kspnews/status/1296261307503505409,0,0,,
2020-08-20,01:32:55,026109M00n,"에고 집사님들 ,강쥐 키우시는 분들 주의하세요 세종에서 고양이가 전기레인지(인덕션)를 건드려 발생한 것으로 추정되는 불이 났다. 20일 세종시소방본부에 따르면 전날 오후 8시31분쯤 나성동의 8층짜리 공동주택 건물 4층에서 화재가 발생했다. 인명피해는 없었지만 주민 60여명이 대피했다 ",https://twitter.com/026109M00n/status/1296258881098719233,3,1,,
2020-08-20,01:22:35,Angry_ToMaTo_TW,더자고싶은데 오늘 뭐점검한다고 3분단위로 화재경보울리,https://twitter.com/Angry_ToMaTo_TW/status/1296256283582951424,0,1,,
2020-08-20,01:21:47,inews24com,#화성 #용주사_화재…#정조‧#사도세자 위패 모셔진 #호성전 전소 #용주사 #아이뉴스24 http://inews24.com/view/1292159,https://twitter.com/inews24com/status/1296256079144169473,0,0,,
2020-09-02,10:43:53,lalalatping,"미백으로 유명한 김민정 크림 이벤트 진행중이네요,, 12차 완판 기념 이벤트래요!!,, 주름 잡티 기미 미백에 효과가 있다니까 피부 고민 있으신분들은 신청해보세요!!",https://twitter.com/lalalatping/status/1301108577822584834,24,83,,
2020-08-20,01:21:46,yH28mLqOoJB3Jca,화성 용주사 호성전 화재로 전소 | 다음 뉴스 https://news.v.daum.net/v/20200820082159381 방화가 아닐까... 광화문집회 도주중인 관련자들 중 광신도의..,https://twitter.com/yH28mLqOoJB3Jca/status/1296256075516133376,1,1,,
2020-08-20,01:20:24,victorkih,"뜨거운 여름 손소독제 자동차 보관 시 화재 위험 있다! https://blog.naver.com/e1korea/222065611576) http://naver.me/FOsDPZO4 알고 있지만, 방심한 내용. 자동차에 손소독제 보관 금지. 주성분이 에탄올이라 화재 위험! ",https://twitter.com/victorkih/status/1296255733013467138,0,0,,
2020-08-20,01:19:45,RIW0nSGw5xwdCGE,이건 뉴스로도 보도 되면 좋겠습니다 여름철 자동차내 #손소독제 화재위험,https://twitter.com/RIW0nSGw5xwdCGE/status/1296255569301393408,0,0,,
2020-08-20,01:18:04,safeppy,여름철 직사광선으로 실내 온도가 높아질 수 있는 자동차에 손소독제를 보관하면 화재 또는 화상 사고가 발생할 수 있어 위험합니다. 소방청 블로그 →https://blog.naver.com/safeppy/222065605852 #소방청 #국립소방연구원 #여름철 #여름 #직사광선 #실내 #온도 #자동차 #코로나19 #손소독제 #화재 #화상 #위험,https://twitter.com/safeppy/status/1296255145630552064,36,13,,
2020-08-20,01:10:33,destroyed_DLZ,어쩜 이렇게 화재경보가 매일 울릴 수가,https://twitter.com/destroyed_DLZ/status/1296253254574120961,0,0,,
2020-08-20,01:08:47,fbkskelo1942,경기도 화성 또!!! 경기도다! 여기 도지사는 어디갔나? 더군다가 저긴 혜경궁홍씨 위패가 모셔진 곳!! 혜경궁김씨가 원조 지우고 진품 행세 할라고 그런건 아니긋제~ 전국 화재사고 | 다음뉴스 https://gallery.v.daum.net/p/viewer/1518/20200820085750294,https://twitter.com/fbkskelo1942/status/1296252808383959046,0,0,,
2020-08-20,01:02:19,D3father,새벽에 귀가 찢어질 듯한 경보음과 화재가 발생했다는 기계음이 스피커에서 울려퍼졌을 때의 묘한 그 기분. 기계 오작동이었지만 그 기분은 가짜가 아니었다.,https://twitter.com/D3father/status/1296251179823796224,0,0,,
