date,time,user_name,text,link,retweet_counts,favorite_counts,hashtags,GeoInformation
2020-08-24,13:30:43,Wandava,"폭염 시작하자 화재 발생?..BMW코리아 ""외부 요인"" 여름엔 장작 ",https://twitter.com/Wandava/status/1297889074313740291,5,0,,
2020-08-24,13:28:03,eastbright2020,올봄 이천 물류창고 화재가 생각나는구먼. 허구한날 현실과 괴리가큰 이상만 쫒는 말만하고 온갖 미사여구로 호감얻고 현혹시키다 일터지면 남탓 모르쇠. 이쯤되면 눈치까야하는거 아닌감? 아직감이 안옴?,https://twitter.com/eastbright2020/status/1297888403803889666,0,0,,
2020-08-24,13:15:36,charlie04072,용인물류센터 화재 인재 빈물탱크 온열장치 전원안꺼 (출처 : 세부 퍼즐투어 | 네이버 카페) http://naver.me/xfhQy04h,https://twitter.com/charlie04072/status/1297885269031444480,0,0,,
2020-08-24,13:03:22,needlekim9dam,리퀘박스 확인해쓰요 천천히 적어오께요~! ※간첩신고는 113 화재신고는 119 윤평신고는 코바늘 신부님이랑 영매 나오는 드라마 리퀘박스는 이쪽에서 운영중입니다 참고하셔요 ,https://twitter.com/needlekim9dam/status/1297882190869434368,0,0,,
2020-08-24,12:59:35,headlinejeju,서귀포 강정동 비닐하우스 창고서 화재 ,https://twitter.com/headlinejeju/status/1297881240607981569,0,0,,
2020-08-24,12:50:47,Lycanroc_s_Nite,흥. 그러고보니 너 가족관계 한 번 끝내주던데? 어떻게 그 조그만 녀석이 네 부모냐?(화재 돌리기),https://twitter.com/Lycanroc_s_Nite/status/1297879024341929984,0,0,,
2020-08-24,12:47:55,blackmary_bot,"그것은 아마도, 화재로 인한 충격 때문이었을 것입니다. ( 한스 )",https://twitter.com/blackmary_bot/status/1297878303844339713,0,0,,
2020-08-24,12:45:08,kspnews,"[케이에스피뉴스] 전남 보성소방서, 폭염 속 냉방기 화재주의 당부 ",https://twitter.com/kspnews/status/1297877600526729216,0,0,,
2020-08-24,12:44:47,fapuutwi334,"홍천소방, 대형화재 취약대상 책임 지도점검",https://twitter.com/fapuutwi334/status/1297877512614055936,0,0,,
2020-08-24,12:38:33,Glynda_BoB,화재진압 들어갑니다!,https://twitter.com/Glynda_BoB/status/1297875944745521152,0,7,,
2020-08-24,12:33:45,fxxkinglovehyun,여운개쩔지 .... 나 그거보고 품제1화재탕함,https://twitter.com/fxxkinglovehyun/status/1297874739348742144,0,0,,
2020-08-24,11:48:03,bbirong_k,개웃곀ㅋㅋㅋㅋㅋㅋㅋ 저런 케이쿠는 또 처음이야... 약간 화재 느낌... ,https://twitter.com/bbirong_k/status/1297863237522710528,0,0,,
2020-08-24,11:44:44,Stella_Cantata,다행이다 얼마 전에 화재났던 절에 있던 위패는 복제품이었다네,https://twitter.com/Stella_Cantata/status/1297862402768171009,0,0,,
2020-08-24,11:37:24,akilover_S2,화재님 저녁 드셧나여??? 저랑 잠깐 저나하실래여&gt;&lt;???,https://twitter.com/akilover_S2/status/1297860554883600387,0,0,,
2020-08-24,11:34:10,imnnnko,"(생략) 쿠로오가 캠프파이어를 즐기는 사이 아빠와 선생님은 오랜만에 집에 애가 없으니까 간만에 술도 마시고 했던 것 같음. 근데 하필 지진이 나고, 전골을 데우던 가스버너가 넘어지며 화재와 동시에 가스폭발이 일어났던 것임. 지진 때문에 움직이기 힘들고 거기다 선생님은 노인이어서",https://twitter.com/imnnnko/status/1297859743122259969,0,8,,
2020-08-24,11:32:35,akilover_S2,ㅠ화재님납바여.,https://twitter.com/akilover_S2/status/1297859345489596418,0,0,,
2020-08-24,11:31:58,DV_Rosaline,"물약 사건 때 생각보다 잘 지내신다 했어요! 실은 힘드셨던 거구나, 우리 고객님! ( 히히 웃으며 당신 등 토닥인다. ) 없... 을 거예요! ( 언제나 확답은 할 수 없다! 그 전에 화재를 돌리려 4코인부터 내밀었다. )",https://twitter.com/DV_Rosaline/status/1297859190887600128,0,0,,
2020-08-24,11:30:32,118296ca7a024eb,대통령님께서 도와주세요 삼성화재 사기보험 교통사고 약도조작 조작업무 업무조작 사건2019고정1491 조현곤 검사님 보험처리업무 방해 박영웅 검사님 경비업무 방해 조작업무 방해를 법대로가 맘대로다 개가개를 개로본개 개죽인개 개가튼개 로트바일러 코로나온 코사이코 몬도까내 개은망덕 폭소뉴스,https://twitter.com/118296ca7a024eb/status/1297858830395555840,0,0,,
2020-08-04,08:22:54,uuukorea4,"요즘 살 빼려고 식단 관리 중인데 이 단백질쉐이크 진짜 좋아요. 맛이 질리지 않고 포만감이 좋아서 저녁마다 먹는데, 한끼 칼로리도 95kcal 밖에 안된다고 합니다. 몸 관리하시는 분들한테 식사 대용으로 딱입니다. 운동은 귀찮고 배고픈건 싫은 분들한테 완전 추천!!!",https://twitter.com/uuukorea4/status/1290563852715745282,1520,3873,,
2020-08-24,11:15:41,x1P0mJLNHkMHrZL,#양키캔들스몰자 2개와 우든 #캔들워머 세트 https://coupa.ng/bIGb3V 캔들워머 사용 장점 1)인테리어 효과 2)연소 유해성분 발생이 없음 3)화재로부터 안전 4)향초 수명 길어짐 #감동추석선물 #감동집들이선물 #감동예산5만원 *파트너스 활동으로 게시자가 일정 수수료를 받을 수 있음,https://twitter.com/x1P0mJLNHkMHrZL/status/1297855092146618369,0,0,,
2020-08-24,11:14:16,118296ca7a024eb,대통령님께서 도와주세요 삼성화재 사기보험 교통사고 약도조작 시정요구를 업무방해로 조현곤 검사님 보험처리업무 방해 박영웅 검사님 경비업무 방해 조작업무 방해를 법대로가 맘대로다 개가개를 개로본개 개죽인개 개가튼개 로트바일러 코로나온 코사이코 몬도까내 개은망덕 패륜사기 이그노벨상,https://twitter.com/118296ca7a024eb/status/1297854733592301571,0,0,,
2020-08-24,11:09:09,a1004sz,아 맞아. . 화재때문에 날라간 설빙 오랜만에가니까 복구됐긴 ㄷ됐는데 직원이. 없어.. ,https://twitter.com/a1004sz/status/1297853447929176064,0,0,,
2020-08-24,10:59:35,kristerini,임 단장은 “무엇보다 급한 것은 일반 격리병상의 충분한 확보” “공공병원에 더는 여력이 없는 만큼 민간 의료기관들의 도움이 절실하다” 이 밖에 도는 고양 일산동구 삼성화재 글로벌캠퍼스와 안성 원곡면 한국표준협회인재개발원에 총 783명을 수용하는 생활치료센터를 이번 주 중 추가로 개소할 예정,https://twitter.com/kristerini/status/1297851039140311040,0,0,,
2020-08-24,10:57:30,akilover_S2,ㅠㅠ울화재님소듕해.,https://twitter.com/akilover_S2/status/1297850515309527040,0,0,,
2020-08-24,10:56:58,Mabi_Mared,"......저는 보육원 출신이라서요. 그마저도 화재로 타 버리는 바람에 근처를 지나던 용병단에 거둬져서 자랐습니다. 여기서 이야기가 길어지는 건 원치 않습니다. 아무튼... 어렸을 땐 살아남기에도 급급해서, 동화책 같은 건 사치였죠.",https://twitter.com/Mabi_Mared/status/1297850382647881728,0,0,,
2020-08-24,10:53:41,go8y4o404gl,동부화재베스트자녀사랑투 &gt;&gt; 삼성생명어린이보험 &gt;&gt; &lt;출처&gt; ,https://twitter.com/go8y4o404gl/status/1297849554025373697,0,0,,
2020-08-24,10:51:09,118296ca7a024eb,대통령님께서 도와주세요 삼성화재 사기보험 교통사고 약도조작 조작업무 업무조작 사건2019고정1491 조현곤 검사님 보험처리업무 방해 박영웅 검사님 경비업무를 방해 조작업무 방해를 법대로가 맘대로다 피해자를 가해자로 코로나온 코사이코 몬도까내 개은망덕 개가개를 개로본개 개죽인개 개가튼개,https://twitter.com/118296ca7a024eb/status/1297848916189130752,0,0,,
2020-08-24,10:50:35,cyp_English,"타라 언커먼 셔츠- FA블레이징 라인 [blaze] v- 1. 활활 타다 2. 눈부시게 빛나다 3. (화가 나서) 눈이 이글거리다 n- 1. 화재 2. 불길, 활활 타는 불 3. 광휘",https://twitter.com/cyp_English/status/1297848776963497985,0,0,,
2020-08-24,10:35:39,aueung,중간마다 두 화씩 합친 에피 나올거 같음 과거 밝혀지면서 전쟁& 숲 화재 길게 나오고 또 셋쇼가 나오면 링이랑 과거 서사 쭉 회상하지 않을까,https://twitter.com/aueung/status/1297845016421732352,0,10,,
2020-08-24,10:34:46,seorimimyo,이제 막 배구틀었는데 항공 유니폼ㅋㅋㅋㅋLG화재 배구단인줄(...),https://twitter.com/seorimimyo/status/1297844793326755840,0,0,,
2020-08-24,10:25:26,dailycnc,삼성화재 ‘승강기사고배상책임보험’ 고유번호로 간편 가입 가능 ,https://twitter.com/dailycnc/status/1297842445682528261,0,0,,
2020-08-24,10:16:50,dssyyhjo,"1호선 구로역 화재, 20분 만에 진화..상·하행선 운행 중단",https://twitter.com/dssyyhjo/status/1297840280360513536,0,0,,
2020-08-24,10:12:56,bgkimin,"기후 변화의 증인들… 폭염과, 폭우, 대형 화재가 일상이 될지도 모른다 http://news.khan.co.kr/kh_news/khan_art_view.html?artid=202008241556001&amp;code=610103&amp;utm_campaign=rss_btn_click&amp;utm_source=khan_rss&amp;utm_medium=rss&amp;utm_content=total_news #mustread #feedly",https://twitter.com/bgkimin/status/1297839299723894787,0,0,#mustread #feedly,
2020-08-24,10:12:44,PRCosmos,캘리포니아에 정화의 에너지를 보냅니다 비의 신께 합장합니다 캘리포니아에 비를 보내주옵소서 화재로 더 이상 인류와 산천초목 빌딩 등이 손상되지 않도록 도우소서 무위화 합장 ,https://twitter.com/PRCosmos/status/1297839248402309121,1,1,,
2020-08-24,10:07:36,2qTYhrWpctTTFYg,"김천소방서, 주택화재 소화기 사용한 초기 진화 ",https://twitter.com/2qTYhrWpctTTFYg/status/1297837959580811269,0,0,,
2020-08-24,10:05:54,with___one,"글쎄, 부가적으로 맡았던 일이 진행이 멈췄지. (단서도 부족하고... 더 이상 화재도 일어나지 않으니까. 이대로 미제로 남으려나?) 음, 몸은 나쁘진 않아.",https://twitter.com/with___one/status/1297837531547832321,0,0,,
2020-08-24,09:57:16,INTERVIEW_text,[마를렌 르 블랑] - 르 블랑 가의 무남독녀. - 아버지 라울 자동차 화재 사고로 사망. 가출로 어머니 레이라와는 떨어져 있는 상태. 현재 헬리오스에 소속되어 명왕이 보호 중. - 어렸을 적부터 납치 위험 자주 발생.,https://twitter.com/INTERVIEW_text/status/1297835356855734274,0,0,,
2020-08-24,09:47:50,erissue,"[아! 이 금융상품]삼성화재, 고유번유만으로 가입 ‘승강기 사고배상 책임보험’ 출시 http://www.econovill.com/news/articleView.html?idxno=409293",https://twitter.com/erissue/status/1297832984721031169,0,0,,
2020-08-24,09:40:47,nagumoamor,그리고 한동안 2학년들 사이에서 화재가 되었다.,https://twitter.com/nagumoamor/status/1297831210060673025,0,1,,
2020-09-02,10:43:53,lalalatping,"미백으로 유명한 김민정 크림 이벤트 진행중이네요,, 12차 완판 기념 이벤트래요!!,, 주름 잡티 기미 미백에 효과가 있다니까 피부 고민 있으신분들은 신청해보세요!!",https://twitter.com/lalalatping/status/1301108577822584834,24,83,,
2020-08-24,09:40:43,BusanTIC,"2020-08-24 18:35 해운대구-수영강변대로, 반여농산물도매시장 - 센텀시티교차로 방향, 반여고가교 지난 지점 3차로, 화물차에서 화재가 나는 단독사고, 처리 중, 뒤로 정체. ",https://twitter.com/BusanTIC/status/1297831193241481218,0,0,,
2020-08-24,09:36:33,TBNBusan,"수영강변대로, 반여농산물도매시장 - 센텀시티교차로 방향, 반여고가교 지난 지점 3차로에 화물차에서 화재가 나는 단독사고가 났으며 처리중임. #tbnkorea",https://twitter.com/TBNBusan/status/1297830145479172096,0,0,#tbnkorea,
2020-08-24,09:16:07,sseagles13,˙정성규 펄펄 날았다˙…남자배구 삼성화재 고희진 감독 첫 승 (출처 : 연합뉴스 | 네이버 스포츠) http://naver.me/xsvfcUEU,https://twitter.com/sseagles13/status/1297824999890288641,0,0,,
2020-08-24,09:09:36,seoultopis,[18:09] 강변북로 일산방향(한남대교→반포대교) 하위차로 차량화재 처리작업 완료되어 정상소통됩니다. ,https://twitter.com/seoultopis/status/1297823360613720065,0,0,,
2020-08-24,09:02:46,samil31_,하아 움모ㅓ 기절은 무슨 안돼요 기절한 새에 인간묹화재라며 끌고가게 생겻으니까 정신빠짝 차리시고 앞으로도 꾸준한 연성을 부탁드릴게요 보는 사람 심장이 남아나질 않겟지만 뭐 어때 호로롭챱 하 맛.잇.어.,https://twitter.com/samil31_/status/1297821642521890816,0,0,,
2020-08-24,08:49:23,B_crazy4u,그니까여..아주 잠시 행복한 꿈이었는데 갑분화재.... 시즌4에서 니콜이 너무 고난이예여ㅠㅠㅠㅠㅠㅠㅠㅠ,https://twitter.com/B_crazy4u/status/1297818272142745602,0,1,,
2020-08-24,08:45:40,jsh7e15,인재라면 정부가 책임지나 세월호 누가 책임물듯 용인 물류센터 화재도 인재..허술한 시설관리가 화마 불러 | 다음 뉴스 ,https://twitter.com/jsh7e15/status/1297817339430281217,0,0,,
2020-08-24,08:41:37,sseagles13,"[KOVO컵]˙바르텍 18점˙ 삼성화재, KB손보 제압…고희진 감독 첫 승 (출처 : 스포츠조선 | 네이버 스포츠) http://naver.me/GRvTEBBy",https://twitter.com/sseagles13/status/1297816318914129920,0,1,,
2020-08-24,08:39:23,ZMjqeqCgjYVBsui,무섭다! 나라 망해야 니들 모가지 유지된다고??? 어떤 짓이라도 할ㄴㄴ들 겁난다. 의혹 많은 물류창고 유류저장소 화재 대형사고??? 관계자분들은 사고 예방에 집중해 주시길... 여적죄는 사형밖에 없다는 건 알지 https://twitter.com/lso3738/status/1297454360000167936,https://twitter.com/ZMjqeqCgjYVBsui/status/1297815759423340544,0,0,,
2020-08-24,08:32:32,ShallallaMiho,"기후 변화의 증인들… 폭염과, 폭우, 대형 화재가 일상이 될지도 모른다 [인터랙티브] 출처 : 경향신문 | 네이버 http://naver.me/5I4Yr0Ru",https://twitter.com/ShallallaMiho/status/1297814034981388288,0,0,,
2020-08-24,08:30:42,STORYJH11,"삼풍백화점과 성수대교 붕괴 사고 및 남산 외국인 아파트 철거, 그리고 대구지하철 화재 사고를 당시 시점의 뉴스로 접한 세대인.. ㅠㅠ ㅋㅋ",https://twitter.com/STORYJH11/status/1297813572093792257,0,0,,
2020-08-24,08:27:13,Vjs8Vt2kimXXJLu,화재 핫플 98년생 단톡방 화재 궁금하면 들어와봐 나가는건 자유니까 검지로 오른쪽을 가리키는 손등검지로 왼쪽을 가리키는 손등 개념챙긴 동갑들이랑 수다나 떨자 http://open.kakao.com/o/gL2E6e9b,https://twitter.com/Vjs8Vt2kimXXJLu/status/1297812696096624640,0,0,,
2020-08-24,08:26:37,kimmmEllen,우리아파트 화재경보음 울리면서 구급차랑 소방차와있어 무서워,https://twitter.com/kimmmEllen/status/1297812542589292546,0,0,,
2020-08-24,08:13:25,seoultopis,[17:13] 강변북로 일산방향(한남대교→반포대교) 차량화재 진압작업으로 4차로 차단되고 있습니다. 후미차량 주의운행하세요. ,https://twitter.com/seoultopis/status/1297809221489049602,0,0,,
2020-08-24,08:12:24,decentd11,"김천소방서, 주택화재 소화기 사용하여 초기 진화 ",https://twitter.com/decentd11/status/1297808967603638273,0,0,,
2020-08-24,08:11:48,tbsseoul,[사고 17:05 현재] 강변북로 (구리 → 일산) 반포대교부근 하위차로 승용차화재후 진화작업으로 정체됩니다. 주의운행하세요. ,https://twitter.com/tbsseoul/status/1297808817665634304,0,0,,
2020-08-24,08:02:38,sportslovenet,8월 24일 배구분석 KB손해보험 vs 삼성화재 ,https://twitter.com/sportslovenet/status/1297806510261702656,0,0,,
2020-08-24,08:02:18,seoultopis,[17:01] 강변북로 일산방향(한남대교→반포대교) 하위차로 차량화재 소식입니다. 후미차량 주의운행하세요. ,https://twitter.com/seoultopis/status/1297806426497101824,1,0,,
2020-08-24,07:50:34,5mkORnegFfMXPks,경기도에 대형화재 나면 전국민에게 재난지원금 주랴? 시급한 피해 당사자들에 한해서만 주면 되는 것이다. 대선용 발언인 거 다 안다. 그만 지껄여..,https://twitter.com/5mkORnegFfMXPks/status/1297803470603313152,3,8,,
2020-08-24,07:50:14,akilover_S2,화재님 엄지손톱 깎아드리기,https://twitter.com/akilover_S2/status/1297803387400945665,0,0,,
2020-08-04,08:22:54,uuukorea4,"요즘 살 빼려고 식단 관리 중인데 이 단백질쉐이크 진짜 좋아요. 맛이 질리지 않고 포만감이 좋아서 저녁마다 먹는데, 한끼 칼로리도 95kcal 밖에 안된다고 합니다. 몸 관리하시는 분들한테 식사 대용으로 딱입니다. 운동은 귀찮고 배고픈건 싫은 분들한테 완전 추천!!!",https://twitter.com/uuukorea4/status/1290563852715745282,1520,3873,,
2020-08-24,07:48:57,akilover_S2,이잉 이이잉 이잉 ㅠㅠㅠㅠㅠ화재님 파이팅이에여~!~!~~!!!!!!,https://twitter.com/akilover_S2/status/1297803067161600002,0,0,,
2020-08-24,07:24:15,go8y4o404gl,농협화재 &gt;&gt; 한국대부금융협회 &gt;&gt; &lt;출처&gt; ,https://twitter.com/go8y4o404gl/status/1297796851458928640,0,0,,
2020-08-24,07:07:12,10jang_saekki,아 시발 머임?? 18일에 우리 학교 화재 일어났었네????,https://twitter.com/10jang_saekki/status/1297792558861410304,0,0,,
2020-08-24,07:03:05,gn33691,"강릉소방서, 화재진압 유공 표창 수여 실시 http://blog.naver.com/gn3369/222069490186",https://twitter.com/gn33691/status/1297791523732385793,0,0,,
2020-08-24,07:00:05,wikitree,이렇게 유명한 호텔에서... 정말 무섭네요 http://i.wik.im/articles/565207 #스페인 #화재 #호텔,https://twitter.com/wikitree/status/1297790766970937344,0,0,,
2020-08-24,06:57:54,BreakNewsCom,[기고] 공동주택 화재예방 첫걸음은 소화기부터 / 브레이크뉴스 ,https://twitter.com/BreakNewsCom/status/1297790216946630658,0,0,,
2020-08-24,06:44:45,pryeouoi381,시화공단 화재 '공장 5개 동 태워'.. 장성 요양병원 화...,https://twitter.com/pryeouoi381/status/1297786907707846657,0,0,,
2020-08-24,06:43:33,_____ss_96,헐시발 갑자기 화재경보 울림 오작동인가 시잘 ㄹ무서구어,https://twitter.com/_____ss_96/status/1297786605424357377,0,0,,
2020-08-24,06:43:20,esangjanya,영국 소방관 파업도 찾아보니 다이나믹 하군요. 군대가 소방관 대신 자체보유 소방차를 운영했지만 화재로 사망자가 여럿 났었다고... ,https://twitter.com/esangjanya/status/1297786554069336064,0,0,,
2020-08-24,06:25:24,tsb_j3,"화재진압 ㅋㅋㅌㅋㅋㅋㅋㅋ ㅇㄴ 제이팁씨 명예 소방관(?) 그런건가바,, 물들어 올때 노나 젓지,,",https://twitter.com/tsb_j3/status/1297782037818912768,0,1,,
2020-08-24,06:23:39,constantin_bot,"존:여기 각각의 성흔은 뭔가 안좋은 일이 일어나는 장소를 가리키고 있어. 원한다면 초자연적인 화재 현장이라고 불러도 돼. 나, 채스, 몇몇 사람들은 일종의 소방관이지.[E03] #콘스탄틴",https://twitter.com/constantin_bot/status/1297781597962264576,0,0,,
2020-08-24,06:12:32,kspnews,"[케이에스피뉴스] 평택시, 고덕면 지역사회보장협의체 화재 피해 가구 지원 봉사 ",https://twitter.com/kspnews/status/1297778802748043264,0,0,,
2020-08-24,06:10:52,vivereeeeeee,티 파토스... 그리스에서도 화재 제티비씨... 찬물끼얹어 화재진압,https://twitter.com/vivereeeeeee/status/1297778381396664320,21,25,,
2020-08-24,05:57:25,minwoo_hm_bot,화재 이후 계솔이가 보이지 않는다. 어디로 간거지?,https://twitter.com/minwoo_hm_bot/status/1297774995435712513,0,0,,
2020-08-24,05:41:49,headlinejeju,"안전보건공단 제주본부, 토평공업단지서 화재 예방 캠페인 전개 ",https://twitter.com/headlinejeju/status/1297771071194542086,0,0,,
2020-08-24,05:36:20,hyun_9069,진짜 미친다 오늘도 화재경보 울림 ,https://twitter.com/hyun_9069/status/1297769689976692736,0,1,,
2020-08-24,05:22:18,twokite68,화재신고는 119 범죄신고는 112 대한민국 구조신고는 118 신고 끝!!,https://twitter.com/twokite68/status/1297766160671207425,0,0,,
2020-08-24,05:19:12,ElcriticoLine,S 순서가 있는 겁니까? V 물론이죠. S 저는 모르겠는데요. V 서열이 있습니다. 훌륭한 작품 순서지요. 만약 어느 날 화재가 발생하면 어디서부터 먼저 가방에 넣어야 할지 저는 알거든요.,https://twitter.com/ElcriticoLine/status/1297765378462892032,0,0,,
2020-08-24,05:03:45,dam_seol,사실 추국이는 물을 다룰 줄 알았고 협회에 등록하지 않은 것은 하난이와 같은 이유 주변에 물만 있으면 원하는 대로 끌어다 모을 수 있으니 당장 소방차가 올 때까지만 버텨야 겠다는 심산으로 화재 현장에 뛰어들어갈 수 있었던 것 호텔에 있던 탱크는 애초에 화재의 원인이 그 곳이었어서,https://twitter.com/dam_seol/status/1297761490603130880,0,7,,
2020-08-24,04:57:24,minwoo_hm_bot,주거지역에서 자유시간을 가진 후 회장의 리드로 백화점으로 이동하기로 결정. 백화점에 원인 모를 화재가 발생했다.,https://twitter.com/minwoo_hm_bot/status/1297759893143736320,0,0,,
2020-09-02,10:43:53,lalalatping,"미백으로 유명한 김민정 크림 이벤트 진행중이네요,, 12차 완판 기념 이벤트래요!!,, 주름 잡티 기미 미백에 효과가 있다니까 피부 고민 있으신분들은 신청해보세요!!",https://twitter.com/lalalatping/status/1301108577822584834,24,83,,
2020-08-24,04:38:49,dam_seol,일반인은 절대로 못 빠져나올 그런 화재였음 그냥 죽을 것 같은.. 거기까지 생각한 하난은 일단 내가 뭐라도 도움이 되어야지 이대로 둘 다 잃을 수 없다 싶은 생각에 건물 안으로 뛰어들어갈 것 같음 사람들이 미쳤냐고 입구 막는 거 뿌리칠 듯 순식간에 큰 힘에 밀려서 어안이 벙벙한 사람들 밀치고,https://twitter.com/dam_seol/status/1297755216259899392,0,5,,
2020-08-24,04:35:37,wayri3z6lgn,삼성화재태아보험 &gt;&gt; 러시앤캐쉬김하늘 &gt;&gt; &lt;출처&gt; ,https://twitter.com/wayri3z6lgn/status/1297754411335159808,0,0,,
2020-08-24,04:32:33,dam_seol,그러던 어느날 큰 불이 났으면 좋겠음 추국이랑 하난 포함한 친구들 여럿이 호텔로 놀러갔는데 호텔에 불이 엄청 크게 붙은거지 불이 서서히 타오른게 아니라 폭발 사고로 시작된 화재라서 겉잡을 수 없이 순식간에 퍼졌으면 하난이는 잠시 호텔 주변 혼자 산책하고 있었는데 큰 굉음이 들려서,https://twitter.com/dam_seol/status/1297753640287887367,1,6,,
2020-08-24,04:22:28,kc_reports," 삼성화재(000810) 2020년 2분기 견조한 실적 시현, 보험업종내 Top picks 유지 2020-08-24 김지영(교보증권) http://hkconsensus.hankyung.com/apps.analysis/analysis.downpdf?report_idx=569326",https://twitter.com/kc_reports/status/1297751103803555841,0,0,,
2020-08-24,04:20:52,akilover_S2,다아화재님생각해서하는소리애여,https://twitter.com/akilover_S2/status/1297750699057397760,0,0,,
2020-08-24,04:17:39,Otranso2,"이란 원자력청 ""나탄즈 핵시설 화재는 의도적 파괴 행위""",https://twitter.com/Otranso2/status/1297749889078554624,0,1,,
2020-08-24,04:13:44,caesarSalad1151,#우비다 #우리의_비혼_다이어리 1. 자기 전에 폰 보다 잠 켜놓고 잠듬 2. 그게 새벽 4시 3. 엄청 시끄러운 자명종 씀. 잠결에 들으면 화재경보등 급. 이거 안 쓰면 못 일어남 3. 고양이 두 마리 있음 알러지인간 안녕 4. 3 때문에 혼자 살아도 14평 이상 살음. 룸메 있을거면 20평 간다,https://twitter.com/caesarSalad1151/status/1297748903014457344,0,2,,
2020-08-24,04:07:54,qarkosori,"화재 난 집에만 물을 뿌려야지, 불도 안난집에 물뿌리면 그것 또한 재난이다 심푸틴아, 니 당이나 잘 해.",https://twitter.com/qarkosori/status/1297747436996145152,0,0,,
2020-08-24,04:03:27,NiclasKang,그래도 화재 신고는 119 잊지 말아야겠죠. 오늘은 118,https://twitter.com/NiclasKang/status/1297746316559171585,0,2,,
2020-08-24,03:59:22,s1HFlYL2z1uu3lz,8월 24일 KB손해보험 삼성화재 분석 한국 프로 배구 : ,https://twitter.com/s1HFlYL2z1uu3lz/status/1297745290577895425,0,0,,
2020-08-24,03:57:21,Vjs8Vt2kimXXJLu,디스코드로 대화도 하고 게임두 하는호랑이 얼굴 98년생 단톡방!호랑이 얼굴 관심있다면 혹시 너도 오지않을랭 ?! 화재 핫플에서놀자! 화재http://open.kakao.com/o/gL2E6e9b,https://twitter.com/Vjs8Vt2kimXXJLu/status/1297744779875241984,0,0,,
2020-08-24,03:54:41,tbsseoul,"[차량화재 12:52 현재] 호남고속도로 (천안 → 순천) 순천2터널부근 3차로,갓길 화물차화재후 처리작업으로 사고위험 있으니 참고하시기 바랍니다. ",https://twitter.com/tbsseoul/status/1297744109566754818,0,0,,
2020-08-24,03:44:44,pryeouoi381,인천 가구 공장 화재..건물 두 동 전소,https://twitter.com/pryeouoi381/status/1297741607098175489,0,0,,
2020-08-24,03:43:58,TBNGwangju,"호남고속도로 순천방향 순천2터널 부근 7km 갓길에서 화물차 화재가 발생하는 단독사고, 사고 여파로 밀려지남#tbnkorea ",https://twitter.com/TBNGwangju/status/1297741412834742275,0,0,,
2020-08-24,03:42:27,Sangyugo_CP,선주:(소화전을 건들여본다.) -화재발생. 화재발생. 전 학년은 선생님의 지시에 따라 대피하시길 바랍니다.- 선주:....('소화전이 너무 시끄러워요.'라고 적힌 종이를 건의함에 넣고있다.),https://twitter.com/Sangyugo_CP/status/1297741033103474688,0,0,,
